[
  {"signal":"bms_battery_voltage","status":"CORROBORATED","semantic_field_id":28,"request":"ReqSubscribeVehicleData","response":"PushVehicleDataHolder","identifier":null,"byte_offset":null,"bit_offset":null,"bit_length":null,"mask":null,"signed":false,"scaling":null,"offset":null,"unit":null,"evidence":[{"kind":"DWARF enum","reference":"SVDF_bms_battery_voltage=28"},{"kind":"protobuf accessor type","reference":"PushVehicleDataHolder::bms_battery_voltage() -> uint32"},{"kind":"optional case","reference":"kBmsBatteryVoltage=28"}],"notes":"Semantic field and protobuf scalar type proven; wire/CAN encoding still unresolved."},
  {"signal":"bms_battery_current","status":"CANDIDATE","semantic_field_id":29,"request":"ReqSubscribeVehicleData","response":"PushVehicleDataHolder","identifier":null,"byte_offset":null,"bit_offset":null,"bit_length":null,"mask":null,"signed":null,"scaling":null,"offset":null,"unit":null,"evidence":[{"kind":"DWARF enum","reference":"SVDF_bms_battery_current=29"}],"notes":"Needs accessor type and serialization tracing."},
  {"signal":"bms_cell_max_voltage","status":"CORROBORATED","semantic_field_id":43,"request":"ReqSubscribeVehicleData","response":"PushVehicleDataHolder","identifier":null,"byte_offset":null,"bit_offset":null,"bit_length":null,"mask":null,"signed":null,"scaling":null,"offset":null,"unit":null,"evidence":[{"kind":"DWARF enum","reference":"SVDF_bms_cell_max_voltage=43"},{"kind":"optional case","reference":"kBmsCellMaxVoltage=43"}],"notes":"Semantic field and optional case cross-check agree; wire encoding unresolved."},
  {"signal":"charging_dc_voltage","status":"CORROBORATED","semantic_field_id":76,"request":"ReqSubscribeVehicleData","response":"PushVehicleDataHolder","identifier":null,"byte_offset":null,"bit_offset":null,"bit_length":null,"mask":null,"signed":true,"scaling":null,"offset":null,"unit":null,"evidence":[{"kind":"DWARF enum","reference":"SVDF_charging_dc_voltage=76"},{"kind":"protobuf accessor type","reference":"PushVehicleDataHolder::charging_dc_voltage() -> int32"}],"notes":"Semantic field and scalar type proven; wire/CAN encoding unresolved."}
]
